indicator_id,indicator,indicator_desc,source_org,source_id
EN.POP.DNST,Population density (people per sq. km of land area),"Population density is midyear population divided by land area in square kilometers. Population is based on the de facto definition of population, which counts all residents regardless of legal status or citizenship--except for refugees not permanently settled in the country of asylum, who are generally considered part of the population of their country of origin. Land area is a country's total area, excluding area under inland water bodies, national claims to continental shelf, and exclusive economic zones. In most cases the definition of inland water bodies includes major rivers and lakes.",Food and Agriculture Organization and World Bank population estimates.,2
NY.GDP.PCAP.PP.KD,"GDP per capita, PPP (constant 2017 international $)",GDP per capita based on purchasing power parity (PPP). PPP GDP is gross domestic product converted to international dollars using purchasing power parity rates. An international dollar has the same purchasing power over GDP as the U.S. dollar has in the United States. GDP at purchaser's prices is the sum of gross value added by all resident producers in the country plus any product taxes and minus any subsidies not included in the value of the products. It is calculated without making deductions for depreciation of fabricated assets or for depletion and degradation of natural resources. Data are in constant 2017 international dollars.,"International Comparison Program, World Bank | World Development Indicators database, World Bank | Eurostat-OECD PPP Programme.",2
SH.UHC.SRVS.CV.XD,UHC service coverage index,"Coverage index for essential health services (based on tracer interventions that include reproductive, maternal, newborn and child health, infectious diseases, noncommunicable diseases and service capacity and access). It is presented on a scale of 0 to 100.","World Health Organization, Global Health Observatory Data Repository (https://www.who.int/data/gho).",2
SP.DYN.LE00.IN,"Life expectancy at birth, total (years)",Life expectancy at birth indicates the number of years a newborn infant would live if prevailing patterns of mortality at the time of its birth were to stay the same throughout its life.,"(1) United Nations Population Division. World Population Prospects: 2019 Revision, or derived from male and female life expectancy at birth from sources such as: (2) Census reports and other statistical publications from national statistical offices, (3) Eurostat: Demographic Statistics, (4) United Nations Statistical Division. Population and Vital Statistics Reprot (various years), (5) U.S. Census Bureau: International Database, and (6) Secretariat of the Pacific Community: Statistics and Demography Programme.",2
SP.POP.0014.TO.ZS,Population ages 0-14 (% of total population),Population between the ages 0 to 14 as a percentage of the total population. Population is based on the de facto definition of population.,World Bank staff estimates based on age/sex distributions of United Nations Population Division's World Population Prospects: 2019 Revision.,2
SP.POP.65UP.TO.ZS,Population ages 65 and above (% of total population),"Population ages 65 and above as a percentage of the total population. Population is based on the de facto definition of population, which counts all residents regardless of legal status or citizenship.",World Bank staff estimates based on age/sex distributions of United Nations Population Division's World Population Prospects: 2019 Revision.,2
SP.POP.TOTL,"Population, total","Total population is based on the de facto definition of population, which counts all residents regardless of legal status or citizenship. The values shown are midyear estimates.","(1) United Nations Population Division. World Population Prospects: 2019 Revision. (2) Census reports and other statistical publications from national statistical offices, (3) Eurostat: Demographic Statistics, (4) United Nations Statistical Division. Population and Vital Statistics Reprot (various years), (5) U.S. Census Bureau: International Database, and (6) Secretariat of the Pacific Community: Statistics and Demography Programme.",2
SP.URB.TOTL.IN.ZS,Urban population (% of total population),Urban population refers to people living in urban areas as defined by national statistical offices. The data are collected and smoothed by United Nations Population Division.,United Nations Population Division. World Urbanization Prospects: 2018 Revision.,2
